title,text,rating,reaction,who,date,website
Нет скорости,"Очень плохая скорость интерната провайдер Megaline. Что можно 
делать!? по началу думал может у меня что то с компьютером но тут 
windows пере установил. И понял что с Интернетом не то. Теперь ломаю 
голову что можно сделать с интернетом.",null,Negative,Nikita,26.04.2012,huzhe.net
Постоянные отключения интернета,"Уже сил нету с этим самым ужасным провайдером мегалайн! 
Отключения каждую минуту! Просто ужас какой-то, если в сутки часа 3 
нормально работает то остальное время идут отключения! За что я вам 
деньги плачу!? Уды чтоб вы подавились моими деньгами и своей услугой! 
Пол года таких мучений, дерёте с нас немыслимые деньги, а услуги самые 
ужасные! Быстрей-бы новый провайдер появился, не задумываясь перешел! 
Ненавижу вас Удов !",null,Negative,Геннадий,11.04.2012,huzhe.net
Интернет,задалбал этот меголайн со своими ужасными услугами !!! постоянные отключения ! за что только деньги платим !?,null,Negative,Геннадий,17.03.2012,huzhe.net
Интернет,"я проживаю в уральске, уже 3-й месяц нет нормальной скорости, 
500 и то не всегда.звонил, ходил .(((((((( добиться не могу",null,Negative,иван,15.03.2012,huzhe.net
Постоянные отключения интернета,"Постоянные отключения интернета, каждые 5 минут отключается 
интернет ! скорость отдачи и приёма очень низкая ! толком не скачать не 
посмотреть не поиграть не возможно ! За что только Платим Деньги ???",null,Negative,Геннадий,05.03.2012,huzhe.net
Skorost,"KAK NADOYELO ETOT MEGALINE, , , POSTOYANNO SKOROSTI NET, , , DA 
BLYAT SKOLKO MOJNO, A ETOT ID TV POLNI PIZDEC JOPA SKAZALI ZA PARU DNEY 
PODKLYUCHET UJE 1 MESYAC JDU, ZAYIBALI ONI UJE.VOT",null,Negative,Karim,27.02.2012,huzhe.net
"Не работает интернет, нет скорости!!!","Два месяца как подключил интернет Казактелеком Мегалайн почти не
 работает, не могу зайти в интернет, если зайду нет скорости. Одни 
нервотрёпки!!! Звонил в Казактелеком Мегалайн, работники пришли, у тебя 
бракованный модем, купил новый, они сказали, - у него мощность 
маленькая, купил 3 модем. Теперь говорят у тебя программное обеспечение 
""тупит"" - они её сами устанавливали и что программное обеспечение нужно 
менять каждый месяц, потом сказали, возможно у тебя сетевая карта 
""тупит"" Вообще они...",null,Negative,Ерлан,22.02.2012,huzhe.net
Megaline блокирует dns сервера google,"Текст не мой но ситуация таже:

При входе на сервисы от Google через Megaline такие как: 
Интернет-магазин Chrome, Android Маркет, не отображаются картинки. 
Испробовал множество браузеров, добавлял эти сайты в исключения в 
файрволе, но потом решил провести эксперемент: зашел на теже сайты, с 
тойже конфигурацией компьютера через мобильный интернет от Beeline, и о 
чудо! Всё прекрасно работает!Получается Megaline намеренно блокирует эти
 сервисы?

И тут я решил выяснить, так в чем же проблема? Ведь...",null,Negative,Павел,17.02.2012,huzhe.net
Очень низкая скорость,"Везде реклама мол мегалайн увеличивает скорость..снижает цены..,
 а на самом то деле во-первых обещанная скорость даже если она есть то 
периодами и эти периоды длятся очень мало и редко, во-вторых это только 
на внутренних рессурсах, в-третьих ну это уже моя личная жалоба..я 
подключил себе Megaline Turbo Plus, когда подключал ождал скорость на 
казнете 8 Mbсек, ну соответсьвенно на внешние рессурсы 4 Mbсек, а у меня
 скорость 4 Mbсек на всё...звонил в ремонт говорят линия перегружина, и 
всё мол...",null,Negative,Макс,05.02.2012,huzhe.net
Скорости нет!!!,"Знаете, это уже совсем наглость! Плочу 4500 тысячи не за что!!! У
 меня безлимитка а я даже немогу страцицу открыть(. Специально поставила
 себе безлимитку чтобы нормально открывалось а в итоге ничего нет, еще 
хуже стало чем было!!! Сделайте нормальный интернет что вы тогда за 
фирма то если не можете предоставить людям за их деньги нормальный 
интеренет! Менйтесь и будут у вас клиенты! Если не изменитесь растеряете
 всех и так уже многие отключают мегалайн из за этого!",null,Negative,Ольга,07.11.2011,huzhe.net
Мегалайн туфта,"Одним словом Мегалайн и Казактелеком зажрались на нет, у меня на
 них даже слов нет т.к. все это бесполезно, они же у нас херовы 
монополисты.",null,Negative,Жандос,03.11.2011,huzhe.net
Speed / ping,"Такого интернета в мире нигде нет самая низкая скорость закачки, самый большой пинг, частые отключения и т.д.",null,Negative,изКазахстана,18.10.2011,huzhe.net
Скорость 3кбай / с,У меня скоростьт скачивания 3 кбит/с устраните эту ошибку!!!пожалуйста!!!,null,Negative,Санат,16.09.2011,huzhe.net
Ужасный провайдер и интернет,"Здравствуйте! Не думал что придется этого делать, но всё-таки 
пришлось. Каждый божий день невозможно нормально посидеть за компьютером
 (за интернетом), т.к. постоянно отключается, также падает передача 
интернета. Примите по этому поводу некоторые меры, я очень настаиваю, на
 Вас очень много людей жалуется. Хотелось бы знать, когда будет 
прекращено некое отключение и когда Вы займетесь этой ""глобальной"" 
проблемой?",null,Negative,Никита,28.08.2011,huzhe.net
Скорость интернета,Почему нет скорости в моем интернете не получаю то за что плачу сколько можно кто ответит на этот вопрос,null,Negative,валентина,25.08.2011,huzhe.net
Упала скорость,"Вместо того, чтобы оправдывать свое заявление по поводу увеличения скорости в два раза, она упала ниже плинтуса... 

Какого, спрашивается, вообще им деньги платить???",null,Negative,Nixe,04.08.2011,huzhe.net
Отсутствие номера справочной,"Поменялись номера справочных служб. Теперь невозможно найти 
телефон интересующего предприятия. Единственно, что можно узнать на 
сайте Казахтелекома, это номер 160. А там уже начинают ""нажмите то, 
нажмите се или дождитесь ответа оператора"". Так вот, ответа оператора 
НИКОГДА НЕ БЫВАЕТ, т.к. ""извините, в настоящий момент все операторы 
заняты"".
Отсутствует также какой-либо актуальный справочник номеров, все 
доступные справочники двух- и более летней давности.",null,Negative,ВалерийИмашев,25.03.2011,huzhe.net
Медленный интернет,"Такая зависть просыпается, во всех странах скорость передачи 
данных исчисляются в мегабитах, а мы как идиоты килобитами 
обламываемся!!!",null,Negative,Макс,08.03.2011,huzhe.net
Не работает интернет,"У меня 2 года как подключен интернет Мегалайн нашей 
телекомпании. Два года нервотрепки. Практически не работает. Пока в 
четверг 17 февраля не позвонила 
в бюро ремонта, ждала 15 минут пока возьмут трубку, пока не отлаяла 
ремонтника толку не было. Как поругалась, так интернет сразу 
заработал.Неужели для того, чтобы заработал интернет, надо звонить и 
ругаться? Ау! Руководство телекома за что Вы берете такие деньги, если 
не работает интернет? Составляете себе зарплату? И когда этот бардак...",null,Negative,Анна,17.02.2011,huzhe.net
Скорость соединения,"Я в 2007 году подал заявку на подключение этого гавна и вот меня
 наконец подключили (это было в 2009 году) в начале вроде бы все было 
норм но затем в 2009 году гдето зимой началось что то особенное т.е. 
скорость загрузки страницы была 1б/с O_O акуеть просто! потом в 2010 
году стало вроде опять норм)) скорость загрузки поднялась до 30кб/с уже 
прогресс но вот сейчас уже 2011 год! и изменений нет! народ посоветуйте 
что нибудь а то ппц живем в гавне и интернет гавно! так хоть интернет 
будет лучше =) 
Спасибо с увожением Жалхас!",null,Negative,Жалхас,30.01.2011,huzhe.net
Не хотят работать,"Работники Казахтелекома не реагируют на жалобы, за что берут 
деньги непонятно, уже почти неделю не хотят искать повреждение на линии 
связи.",null,Negative,ЛютиковАнатолий,30.06.2014,huzhe.net
Телефонные провода,"Телефонные провода висят - неправильно устанавливают - от столба до столба, от земли всего 2 метра",null,Negative,Баглан,18.05.2014,huzhe.net
Интернет мегалайн,Плохое соединение постоянно разрывается низкая скорость и качество интернета.,null,Negative,юрий,11.05.2014,huzhe.net
Качество услуг,"Раньше я платил 2000 т. Т за тариф старт, сейчас плачу 4000 т. Т
 а разницы по скорости никакой. Лучше буду платить 12000 т. Т в год за 
usb модем при такой - же скорости без ограничений. Подскажите пожалуйста
 как мне отключиться от мегалайн и платить только за услуги телефона. . .",null,Negative,Андрей,10.05.2014,huzhe.net
Зажрались,"Вот здравствуйте. Я конечно не уверен, что на это письмо 
ответят, или обратят внимание., НО все же ...мы живем в 21 веке. А 
интернет не могут провести, ..от моего дома ваш ящик находится на 
расстоянии 200 метров. Вы зажрались. Я уже готов платить больше за 
подключение.и вообще, почему вы не работаете. Я запарился к вам ходить. 
Теперь буду строчить жалобы. Так проще.т.к. вы игнорируете.и это, только
 начало...",null,Negative,серега,02.02.2014,huzhe.net
Интернет,"Интернет все праздники виснет и сегодня уже 8 января все 
бесконечно пропадает. Мы за что платим вам? За городской телефонный 
номер платим хотела бы отказаться да нет нельзя интернета не будет . За 
телефон плати (им вообще не пользуемся только вечером) за и- нет плати. 
Хотя городской телефон уже и не нужен у всех есть сотки. Казахтелеком, 
неужели нельзя телефонную сделать отдельно от интернета или вам это 
прибыльно. Кому нужен городской пусть пользуются и платят, кому не нужен",null,Negative,Жанара,08.01.2014,huzhe.net
Неожиданно все погнало,"Уважаемые Руководители ID TV, я являюсь пользователем вашего 
интернета 3 год! В целом в большей степени я доволен вашим пакетом id tv
 и интернетом, да не спорю бывают и глюки и зависает, скорость резко 
падает но это иногда, в большинстве случаев все работает отлично! Я живу
 в частном секторе и на тот момент когда я хотел установить интернет 
Ваша компания оказалась единственной кто мог меня удовлетворить т.к. все
 остальные отмазывались мол не работают по частным секторам, - "" да, мы к
 вам едем!""...",null,Negative,Aslan,03.12.2013,huzhe.net
Провайдеры уроды,"провайдеры вы добьетесь что останетесь без штанов за поставления
 такого не конкретного интернета не успеешь его подключить тут же он 
отключается разве это дело???я откажусь от ваших услуг ненужных",null,Negative,илья,17.11.2013,huzhe.net
Падающая скорость казахтелеком,"На протяжении 10 месяце провайдер травит нас как тараканов есть 
Инет радуйтесь нет Инета молчите. Вообщем все происходит так в течении 
дня история одна инет висит тв висит картинка отдельно от звука. Ху...я 
какая то. Серваки грузят клиентов хапают качества ноль.",null,Negative,Наталья,02.10.2013,huzhe.net
Подключение интернета,"хотел подключить интернет, живу в частном сектор..в 
казахтелекоме заключил договор с 30 июля 2013 года, на подключение 
интернета.уже октябрь месяц и до сих пор не подключают интернет, в связи
 с этим прошу рассмотреть мою жалобу и принять меры!",null,Negative,бейсен,01.10.2013,huzhe.net
Интернет,"мегалайн турбо- ЭТО гав*о, в самом плохом смысле этого слова, 
пано*с, нет слов. вот мне бы сейчас того человека, который бы мне 
скажет, что, мегалайн турбо-это тема, Я бы его порвал, как шарик 
фуфайку.",null,Negative,кайрат,16.08.2013,huzhe.net
Установка интернет,"В Казтелекоме на установку интернета стою уже больше года с мая 
прошлого года. В квартире есть телефонная линия и ко всем квартирам в 
подезде подведен оптиковалконые кабели. Как звонишь Казтелеком один 
только ответ нет технической возможности подключения. Хотя через два 
дома есть оптиковалоконая и мегалайн. Когда же в Усть-Каменогорске 
нормально будет работать Казтелеком",null,Negative,Муратбек,25.07.2013,huzhe.net
Плохая работа!,"Здравствуйте! телефон сломался с 16 июня и до сих пор не сделан.
 тариф супер хит - за что я плачу деньги? интернета нету позвонить не 
могу. а причина - дерево. все время дерево росло а сейчас стало мешать? 
скорость ужасная. иногда нормально но к концу месяца и иногда и в начале
 скорость становится невыносимой, даже почту не открывает. что вообще за
 дела? когда начнется нормальное обслуживание ?",null,Negative,Карина,19.06.2013,huzhe.net
Megaline turbo,скорость интернета очень маленькая гно не подключайтесь к этому тарифному плану,null,Negative,Эдуард,14.06.2013,huzhe.net
Ужасная скорость,"У меня тарифный план Megaline Turbo Plus, но скорость ужасная 
невозможно пользоваться приходиться некоторое время ждать пока странница
 загрузится. Из всего месяца только около недели интернет работет более 
шустрее...",null,Negative,Равиль,04.05.2013,huzhe.net
Мегалайн старт,"Всем привет! Все кто не доволен качеством услуг Мегалаина. Прошу
 обращаться ко мне. Так как по моему заявлению, общество защиты 
потребителей, через суд предьявит Казахтелекому ""за качество"" 
предоставляемых услуг Мегалаин. Необходимо как можно больше заявлении от
 пользователей услуг Мегалаина недовольных качеством. Сколько можно нас 
обманывать? Жду Ваших обращении. С уваженим, Сабит. e-mail.: 
molsabi@mail.ru",null,Negative,Сабит,21.04.2013,huzhe.net
Разобраться и дать ответ разумный,"Прошу Вас, объснить почему такое отвратительное отношения 
сотрудников Казтелекома г.Усть-Каменорска на заяки потребителей интернет
 . Я подал заявку на установку интернет в мае месяце 2012года, уже год 
прошел как я жду подключения. На мои звонки по №160 отвечают, 
протестировали вашу телефонную линию возможности нету подключения, 
объясните пожалуста во всем доме и у моих соседей по пдъезду есть 
интернет мегалайн, а ко мне что ли провели отдельную телефонную линиию 
от Казтелекома...",null,Negative,Муратбек,05.04.2013,huzhe.net
Качество обслуги,"неоднократное обращение по поводу долгов приписок, постоянно 
жалобы звонки "" нет скорости"", уже с сыном устали звонить, я 
пенсионерка, сын на инвалидности, ходить мне тяжело задыхаюсь ноги 
болят, а по телефону доводят до нервного срыва, это к нам такое 
отношение пенсионерке и инвалиду, с начало месяца начинается, а в конце,
 вообще можно не включать компьютер, за что несчастные копейки платим у 
сын пенсия 17, 900 и у меня 28, 700, и нас еще оббирают каждый месяц 
приписывают определитель...",null,Negative,альфия,03.04.2013,huzhe.net
Обслуживание,"Скорее это не жалоба, а претензия! Пользователем Мегалайна, 
являюсь уже несколько лет, раньше ну позвонишь - придут -отремонтируют, 
ну а сейчас в течении полугода -бесполезно, придут, скорость измерят, 
руками разведут, меж собою по телефону переговорят на этом и все .А мы 
регулярно платим деньги и не малые, а вот Ваш прогресс у меня лично и не
 тянет . Сетовали на компьютер- заменила .А не думаете Вы Уважаемые 
Господа! Что у Вас что-то или кого-то надо сменить .Очень надеюсь на 
ответ или реакцию.",null,Negative,Антонина,12.03.2013,huzhe.net
Internet,"Уже скоко дней етот интернет барохлит подключается и захожу в 
интернет смотрю кино сижу в агенте и на те агентотключился загрузка 
киношки останавилось смотрю подключен ли инет подключен но нееееекууда 
не заходит!звоню в мегалйн они говорят что подключим спецом но ети спецы
 умерли незнаю не берут телефоны берут опят говорят ждите опять ждещ 
час!! играю игры через инет меня как всегда выкидувают !! (( еслип не 
сработает мой инет через 3 дня потом жалобу на городскую если опят нет я
 пойду подвм в суд",null,Negative,ОМирсерик,08.03.2013,huzhe.net
Интернет,"Вот скажите где общенная корость в 1 мб/сек, если в данный момент http://www.speedtest.net/result/2545470769.png",null,Negative,Onotole,02.03.2013,huzhe.net
